job_title,company_name,posted_date,num_applications,job_modality,f_p_time,job_responsibility,job_skills,job_keyword,city,community_or_nation,country,annual_salary,offer_id
Estadístico/a con experiencia en programación en lenguaje R,Psicoanalista en Madrid,2024-03-06,80,Presencial,Jornada completa,,"Análisis de datos estadísticos, Estadística, Modelos estadísticos, Modelos matemáticos y R (Lenguaje de programación)",Data Scientist,Madrid,Comunidad de Madrid,España,,0
Analista de Datos/ Data Analyst - Centro de I+D+ i,ALSA,2024-03-12,66,Híbrido,Jornada completa,Junior,"Analítica de datos, Bases de datos, Capacidad de análisis, Inglés y Resolución de problemas, Diseño de procesos, Estadística, Minería de datos, Modelos analíticos y Preparación de datos",Data Analyst,Gijón,Principado de Asturias,España,,1
Consultor/a BI | Teletrabajo,ALTEN,2024-03-09,879,En remoto,Jornada completa,Intermedio,,Data Analyst,Barcelona,Cataluña,España,,2
Consultor BI,CGI,2024-03-12,76,Híbrido,Jornada completa,Intermedio,,Data Analyst,Madrid,Comunidad de Madrid,España,,3
Data Analyst,TD SYNNEX,2024-02-28,72,Híbrido,Jornada completa,Junior,,Data Analyst,Barcelona,Cataluña,España,,4
BI Analyst,Criteo,2024-03-06,720,Híbrido,Jornada completa,Intermedio,,Data Analyst,Barcelona,Cataluña,España,,5
Data Analyst - People (They/She/He),Glovo,2024-03-06,30,Híbrido,Jornada completa,Intermedio,,Data Analyst,Barcelona,Cataluña,España,,6
Analista de datos,Grupo Godó de Comunicación,2024-02-21,536,Presencial,Jornada completa,Intermedio,,Data Analyst,Barcelona,Cataluña,España,,7
Data Analyst,Veeva Systems,2024-02-28,980,En remoto,Jornada completa,,,Data Analyst,,,España,,8
Data Analyst,Huxley,2024-03-06,437,En remoto,Jornada completa,Intermedio,,Data Analyst,Barcelona,Cataluña,España,,9
Data Analyst,Novicap,2024-03-09,41,Híbrido,Jornada completa,Intermedio,,Data Analyst,Barcelona,Cataluña,España,,10
Data & Analyst Executive,dentsu,2024-03-06,54,Híbrido,Jornada completa,Junior,,Data Analyst,Madrid,Comunidad de Madrid,España,,11
Data Governance Analyst,Revolut,2024-03-06,46,En remoto,Jornada completa,Junior,,Data Analyst,,,España,,12
Data Analyst (becario),Eurofirms Group | People first,2024-03-06,83,Presencial,Jornada completa,Junior,,Data Analyst,Cassà de la Selva,Cataluña,España,,13
"Data Analyst, Business Performance Analytics",Criteo,2024-03-10,93,Híbrido,Jornada completa,Intermedio,,Data Analyst,Barcelona,Cataluña,España,,14
Operations Data Analyst (They/She/He),Glovo,2024-02-28,934,Híbrido,Jornada completa,Junior,,Data Analyst,Barcelona,Cataluña,España,,15
Data Analyst GCP,knowmad mood,2024-02-21,178,Híbrido,Jornada completa,Intermedio,,Data Analyst,Madrid,Comunidad de Madrid,España,,16
Product Data Analyst (Analytics & Insights Team),Semrush,2024-03-10,73,En remoto,Jornada completa,Junior,,Data Analyst,,Cataluña,España,,17
Data Analyst - SQL y PySpark,excelia,2024-03-10,576,Híbrido,Jornada completa,Intermedio,,Data Analyst,Madrid,Comunidad de Madrid,España,,18
Online Data Analyst - Spain,TELUS International AI Data Solutions,2024-02-28,1062,En remoto,Media jornada,Junior,,Data Analyst,,Comunidad de Madrid,España,,19
Data Analyst Senior,Werfen,2024-03-06,144,Híbrido,Jornada completa,Senior,,Data Analyst,Barcelona,Cataluña,España,,20
BECARIO/A QUANTITATIVE RESEARCHER,MANGO,2024-03-06,93,Híbrido,Jornada completa,Intermedio,,Data Scientist,Palau-solità i Plegamans,Cataluña,España,,21
Data Analyst Omnichannel,Hays,2024-03-06,41,Híbrido,Jornada completa,Intermedio,,Data Analyst,Barcelona,Cataluña,España,,22
Information Protection Analyst,Technip Energies,2024-02-28,20,Presencial,Jornada completa,Intermedio,,Data Analyst,Barcelona,Cataluña,España,,23
Data Analyst - Courier (They/She/He),Glovo,2024-02-21,52,Presencial,Jornada completa,Intermedio,,Data Analyst,Barcelona,Cataluña,España,,24
Courier Data Analyst (They/She/He),Glovo,2024-02-28,904,Híbrido,Jornada completa,Junior,,Data Analyst,Barcelona,Cataluña,España,,25
Functional & Ind Analytics - Analyst,Accenture España,2024-02-28,73,Híbrido,Jornada completa,Junior,,Data Analyst,Madrid,Comunidad de Madrid,España,,26
Lead Data Analyst,Bradford Jacobs,2024-02-28,1199,Híbrido,Jornada completa,Intermedio,,Data Analyst,Barcelona,Cataluña,España,,27
Digital Projects & Analytics Sr Analyst,dsm-firmenich,2024-03-06,31,Híbrido,Jornada completa,Senior,,Data Analyst,Barcelona,Cataluña,España,,28
Digital Projects & Analytics Sr Analyst,dsm-firmenich,2024-02-14,25,Híbrido,Jornada completa,Senior,,Data Analyst,Barcelona,Cataluña,España,,29
Language Data Analyst,TELUS International,2024-02-28,803,En remoto,,Junior,,Data Analyst,,,España,,30
Principal Biostatistician,Meet,2024-02-28,452,En remoto,Jornada completa,Intermedio,,Data Scientist,,,España,,31
Data Analyst - Certificado Discapacidad,SDG Group España,2024-02-21,47,Híbrido,Jornada completa,Junior,,Data Analyst,Barcelona,Cataluña,España,,32
Analista Funcional - BI (PowerCenter),Plexus Tech,2024-03-09,98,En remoto,Jornada completa,Intermedio,,Data Analyst,,,España,,33
Analytics Senior Consultant,JAKALA Iberia,2024-02-21,29,Híbrido,Jornada completa,Senior,,Data Analyst,Madrid,Comunidad de Madrid,España,,34
Senior Business Intelligence Analyst,Thunes,2024-02-21,85,Híbrido,Jornada completa,Senior,,Data Analyst,Barcelona,Cataluña,España,,35
"Data Analyst (Bangkok Based, relocation provided)",Agoda,2024-02-28,135,,,Intermedio,,Data Analyst,Barcelona,Cataluña,España,,36
Senior Consultant Power BI Expert,SDG Group España,2024-03-11,368,Híbrido,Jornada completa,Senior,,Data Analyst,Barcelona,Cataluña,España,,37
Analytics and Modeling Senior Analyst (All Spain),Accenture España,2024-03-06,13,Híbrido,Jornada completa,Senior,,Data Analyst,Madrid,Comunidad de Madrid,España,,38
Sr Digital Data Analyst,MRM Spain,2024-03-09,44,Híbrido,Jornada completa,Senior,,Data Analyst,Madrid,,,,39
Senior Consultant Power BI Expert,SDG Group España,2024-03-11,159,Híbrido,Jornada completa,Senior,,Data Analyst,Madrid,,,,40
Data & Analytics Consultant,Incubeta,2023-10-13,926,Híbrido,Jornada completa,,,Data Analyst,Madrid,Comunidad de Madrid,España,,41
"Analyst/Senior Analyst (Analytics, Bangkok-based, Relocation provided)",Agoda,2024-02-28,26,,,Senior,,Data Analyst,Barcelona,Cataluña,España,,42
Lease Data Analyst - INGKA Centres,Ingka Centres,2024-02-21,37,Presencial,Jornada completa,,,Data Analyst,San Sebastián de los Reyes,Comunidad de Madrid,España,,43
"Analyst/Senior Analyst (Analytics, Bangkok-based, Relocation provided)",Agoda,2024-02-28,17,,,Senior,,Data Analyst,Málaga,Andalucía,España,,44
Data Analyst intern,ZINIO,2024-02-13,728,Híbrido,Jornada completa,,,Data Analyst,Barcelona,Cataluña,España,,45
Senior Marketing Data Analyst - Monopoly GO!,Scopely,2024-02-28,511,Híbrido,Jornada completa,Senior,,Data Analyst,Barcelona,Cataluña,España,,46
Técnico/a analista de datos,365 Obrador,2024-03-09,95,Presencial,Jornada completa,Intermedio,,Data Analyst,Barcelona,Cataluña,España,,47
Senior Data Analyst Team Lead,Devire,2024-02-21,17,Híbrido,Jornada completa,Senior,,Data Analyst,Santa Cruz de Tenerife,Canarias,España,,48
Sales Operations Data Analyst Intern,Criteo,2024-03-10,62,Híbrido,,Junior,,Data Analyst,Barcelona,Cataluña,España,,49
"Analyst/Senior Analyst (Analytics, Bangkok-based, Relocation provided)",Agoda,2024-02-28,15,,,Senior,,Data Analyst,Bilbao,País Vasco,España,,50
Online Data Analyst,TELUS International,2024-02-21,83,En remoto,Media jornada,Junior,,Data Analyst,Valladolid,Castilla y León,España,,51
"Analyst/Senior Analyst (Analytics, Bangkok-based, Relocation provided)",Agoda,2024-02-28,18,,,Senior,,Data Analyst,Valencia,Comunidad Valenciana,España,,52
Data Analyst Internship,Johnson & Johnson,2024-03-07,377,Presencial,Jornada completa,,,Data Analyst,Barcelona,Cataluña,España,,53
Swedish Language Data Analyst,TELUS International,2024-02-28,8,Presencial,Jornada completa,Junior,,Data Analyst,Barcelona,Cataluña,España,,54
"Senior Data Analyst (Bangkok Based, relocation provided)",Agoda,2024-03-11,14,,,Senior,,Data Analyst,Madrid,Comunidad de Madrid,España,,55
Ops Tech Data Engineer / Analyst,HelloFresh,2024-02-28,848,,,Junior,,Data Analyst,Barcelona,Cataluña,España,,56
Data Analyst | BI Specialist  | Paris or Barcelona | Major company | 50% Remote,Talent-R,2024-02-28,385,Presencial,Jornada completa,Intermedio,,Data Analyst,Barcelona,Cataluña,España,,57
Beca Consultoría de Riesgos - Data Analyst (R y Python),Marsh,2024-03-06,94,Híbrido,,Junior,,Data Analyst,Madrid,Comunidad de Madrid,España,,58
Data Analyst Portfolio,Banco Sabadell,2024-03-09,135,Híbrido,Jornada completa,,,Data Analyst,Sant Cugat del Vallès,Cataluña,España,,59
Data and Pricing Analyst(m/f/d),DEKRA España,2024-03-06,288,Híbrido,Jornada completa,Intermedio,,Data Analyst,Madrid,Comunidad de Madrid,España,,60
Energy Data Analyst,Siemens Energy,2024-02-28,1109,Presencial,Jornada completa,Intermedio,,Data Analyst,Barcelona,Cataluña,España,,61
Valuations Data Analyst,CBRE España,2024-02-21,56,Híbrido,Jornada completa,Junior,,Data Analyst,,Comunidad de Madrid,España,,62
Analytics & Tagging Specialist_Sr Analyst,Accenture España,2024-02-28,31,Híbrido,Jornada completa,Intermedio,,Data Analyst,Madrid,Comunidad de Madrid,España,,63
Technical Data Analyst ESG,LHH,2024-03-06,38,Presencial,Jornada completa,Intermedio,,Data Analyst,Madrid,Comunidad de Madrid,España,,64
Business Analyst – Metadata Management & Data Governance,AstraZeneca,2024-03-09,14,,,Intermedio,,Data Analyst,Barcelona,Cataluña,España,,65
Sales Support Data Analyst,Axalta Coating Systems,2024-02-28,18,Presencial,Jornada completa,Junior,,Data Analyst,Asturias,España,,,66
Amplifon GAES_ Retail Store Performance Data Analyst,Amplifon,2024-02-21,56,Híbrido,Jornada completa,Junior,,Data Analyst,Barcelona,Cataluña,España,,67
Data and Innovation Analyst - Internal Audit,Air Products,2024-03-06,30,En remoto,Jornada completa,,,Data Analyst,Cornellà de Llobregat,Cataluña,España,,68
Entry Level SAP BI Technical Support Analyst,Eursap - Europe's #1 SAP Recruitment Agency ⭐️⭐️⭐️⭐️⭐️,2024-02-28,90,Híbrido,Jornada completa,Junior,,Data Analyst,Barcelona,Cataluña,España,,69
Consumer Panel Data (CPS) Consultant&Analyst Director Iberia,NielsenIQ,2024-03-06,35,Presencial,Jornada completa,Intermedio,,Data Analyst,Barcelona,Cataluña,España,,70
Senior E-commerce Data Analyst – Luxury Brand,Carl Friedrik,2024-02-14,793,Híbrido,Jornada completa,Senior,,Data Analyst,Barcelona,Cataluña,España,,71
SAP Analytics Consultant,Accenture España,2024-02-28,1046,,,Junior,,Data Analyst,Madrid,Comunidad de Madrid,España,,72
Business Insight Senior Analyst,SII Group Spain,2024-02-28,66,Híbrido,Jornada completa,Senior,,Data Analyst,Viladecans,Cataluña,España,,73
Consumer Panel Data (CPS) Consultant&Analyst Director Iberia,NielsenIQ,2024-03-06,41,Presencial,Jornada completa,Intermedio,,Data Analyst,Madrid,Comunidad de Madrid,España,,74
Consultor/a riesgos financieros (Quant Analyst),Mazars España,2024-03-06,1104,Híbrido,Jornada completa,Intermedio,"Análisis de datos y Ciencia de datos, Analítica, Análisis cuantitativo, Análisis financiero cuantitativo, Estadística, Maquettes, Modelos de riesgo, Riesgo de crédito y Validación de modelos",Data Analyst,Barcelona,Cataluña,España,,75
"Senior Data Analyst, Global Tax Services",Amazon,2024-03-12,60,,,Senior,"Analítica de datos y SQL, Adquisición indirecta, Analítica, Analítica empresarial, Cumplimiento de obligaciones fiscales, Especificaciones técnicas, Gestión de datos, Impuestos indirectos y Necesidades empresariales",Data Analyst,Barcelona,Cataluña,España,,76
Analista de Datos Industriales,RDT Ingenieros,2024-03-09,29,Presencial,Jornada completa,Intermedio,,Data Analyst,Derio,País Vasco,España,,77
"Business Data Analyst (Bangkok Based, relocation provided)",Agoda,2024-03-12,76,,,Intermedio,"Comunicación, Resolución de problemas y SQL, Capacidad de razonamiento, Ciencias de la computación, Estadística, Estrategia de fijación de precios, Marketing digital, Panel de control y Tecnología de publicación de anuncios",Data Analyst,Barcelona,Cataluña,España,,78
(Senior) DSP Campaign Manager / Data Analyst,RevX,2024-02-13,336,Híbrido,Jornada completa,Senior,"Analítica de datos y Análisis de datos, Compra programática de espacios publicitarios, Plataforma de demanda (DSP), Programmatic Advertising, Publicidad móvil, Puja en tiempo real y Remarketing",Data Analyst,Barcelona,Cataluña,España,,79
Sr. Business Analyst Customer Data Platform (CDP & salesforce),Novartis,2024-03-06,51,Presencial,Jornada completa,Senior,"Analítica de datos, Capacidad de análisis y Comunicación, Análisis de marketing, Ciencias de la computación, Desarrollo Salesforce.com, Necesidades empresariales, Negociación, Planes de desarrollo de productos y Salesforce Marketing Cloud",Data Analyst,Barcelona,Cataluña,España,,80
Basketball Statistician (Data Collection),Genius Sports,2024-03-06,41,Presencial,,,"Inglés, Adquisición de conocimientos, Baloncesto, Definición de requisitos, Deportes, Industry Training, Inglés hablado, Jugabilidad, Recogida de datos y Sports Venues",Data Scientist,Ciutadella de Menorca,Islas Baleares,España,,81
SENIOR DATA ANALYTICS CONSULTANT- Madrid,The Information Lab Spain,2023-11-13,174,Presencial,Jornada completa,Senior,,Data Analyst,Madrid,Comunidad de Madrid,España,,82
SAP Analytics Cloud Consultant,T4S Advance Solutions,2024-02-21,10,Híbrido,Jornada completa,Intermedio,"Inglés y Trabajo en equipo, ABAP, Estrategia empresarial, Inteligencia empresarial, Liderazgo de equipos, Microsoft SQL Server, Protocolo de Internet (IP), SAP BW y XML",Data Analyst,Madrid,,,,83
Package Consultant - SAP HANA Adv Analytics,IBM,2024-02-28,23,Híbrido,Jornada completa,,"Análisis predictivo, Competencias transversales, Contabilidad de gestión, Contabilidad exigida por ley, Elaboración de informes de datos, Productos SAP, SAP BW, SAP BusinessObjects, SAP HANA y SAP Lumira",Data Analyst,Barcelona,Cataluña,España,,84
Package Consultant - SAP HANA Adv Analytics,IBM,2024-02-28,25,Híbrido,Jornada completa,,"Análisis predictivo, Competencias transversales, Contabilidad de gestión, Contabilidad exigida por ley, Elaboración de informes de datos, Productos SAP, SAP BW, SAP BusinessObjects, SAP HANA y SAP Lumira",Data Analyst,Madrid,Comunidad de Madrid,España,,85
"Senior Data Analyst, Customer Payments (Relocation to Tallinn)",Bolt,2024-03-06,16,Híbrido,Jornada completa,Senior,,Data Analyst,Madrid,Comunidad de Madrid,España,,86
SAP Analytics Cloud Consultant,VASS,2024-03-11,16,Híbrido,Jornada completa,,"Comunicación, Inglés y Tableau, ABAP, Contabilidad exigida por ley, Planificación de negocios y sistemas de control, Productos SAP, SAP BW, SAP HANA y SAP Projects",Data Analyst,Madrid,Comunidad de Madrid,España,,87
Football Statistician (Data Collection),Genius Sports,2024-03-06,97,Presencial,,,"Inglés, Adquisición de conocimientos, Definición de requisitos, Deportes, Fútbol americano, Industry Training, Inglés hablado, Jugabilidad, Recogida de datos y Sports Venues",Data Scientist,Córdoba,Andalucía,España,,88
Data Analyst,agap2 España,2024-03-11,77,Híbrido,Jornada completa,Intermedio,"Capacidad de análisis, Python, Trabajo en equipo, Visualización y Visualización de datos, Análisis de requisitos, Estadística, Inteligencia empresarial, Matemáticas y Panel de control",Data Analyst,Sevilla,Andalucía,España,,89
Senior Business Analyst - Data Focus,Thoughtworks,2024-03-09,14,Presencial,Jornada completa,Senior,"Capacidad de análisis y Resolución de problemas, Asesor, Atención al detalle, Educción de requisitos, Necesidades empresariales, Obtención de requisitos, Planes de desarrollo de productos, Procesos de negocio y Professional Skills",Data Analyst,Madrid,Comunidad de Madrid,España,,90
Data Analyst - Pharma Company,Grafton Recruitment,2024-03-09,77,Presencial,Jornada completa,Intermedio,"Análisis de datos, Capacidad de análisis y Inglés, Análisis de negocio, Elaboración de informes, Informes y análisis y Microsoft Dynamics NAV",Data Analyst,Madrid,Comunidad de Madrid,España,,91
Data Analyst (Oracle) @ Deutsche telekom (f/m),T-Systems Iberia,2024-03-12,17,Híbrido,Jornada completa,Intermedio,"Bases de datos y Python, Análisis estadístico, Aprendizaje personalizado, Big data, Competencias transversales, KNIME, Modelado de datos, Modelado de datos lógicos y Oracle Application Express",Data Analyst,Granada,Andalucía,España,,92
Business Intelligence Analyst,Ria Money Transfer,2024-03-12,184,Híbrido,Jornada completa,,"Analítica de datos, Comunicación y Resolución de problemas, Analítica, Comunicación escrita, Extraer, transformar y cargar (ETL), Informes y análisis, Pensamiento crítico, Presentaciones y Procedimientos de almacenado",Data Analyst,Alcobendas,Comunidad de Madrid,España,,93
Senior Data Analyst – Business Intelligence,Radisson Hotel Group,2024-03-12,7,Híbrido,Jornada completa,Senior,"Visualización de datos, Analítica, Arquitectura de datos, Calidad de datos, Contabilidad exigida por ley, Datos maestros, Gestión de datos, Pensamiento crítico, Perfiles de datos y SAP CRM",Data Analyst,Madrid,Comunidad de Madrid,España,,94
Multilingual Data Analyst Intern,Morningstar,2023-07-13,1138,,,Junior,,Data Analyst,Madrid,Comunidad de Madrid,España,,95
Business Data Senior Analyst (12 Months Maternity Cover),Amadeus,2024-03-06,23,Híbrido,,Senior,"Analítica de datos, Bases de datos, Ciencia de datos, Visualización y Visualización de datos, Analítica, Calidad de datos, Gestión de datos, Panel de control y Qlik Sense",Data Analyst,Madrid,Comunidad de Madrid,España,,96
Analista de datos,LLYC,2023-10-13,669,Híbrido,Jornada completa,Junior,,Data Analyst,Madrid,Comunidad de Madrid,España,,97
Consultor Senior BI,LHH,2024-03-06,18,,,Senior,"Bases de datos y Inglés, Almacenamiento de datos, Inteligencia empresarial, Liderazgo de equipos, MicroStrategy, Modelado de datos, Negociación, Panel de control y Procesamiento analítico en línea (OLAP)",Data Analyst,Barcelona,Cataluña,España,,98
BI Analyst,LLYC,2023-06-13,677,Híbrido,Jornada completa,Intermedio,"Bases de datos, Ciencia de datos y Visualización de datos, Analítica, Extraer, transformar y cargar (ETL), Google Analytics, Google BigQuery, Indicadores clave de desempeño, Modelado de datos y Panel de control",Data Analyst,Madrid,Comunidad de Madrid,España,,99
BI Data Analyst,Capgemini Engineering,2024-02-13,974,Híbrido,Jornada completa,Intermedio,"Analítica de datos, Bases de datos, Capacidad de análisis, SQL y Visualización de datos, Almacenamiento de datos, Expresiones de análisis de datos (DAX), Inteligencia empresarial, Modelado de datos y Panel de control",Data Analyst,Madrid,Comunidad de Madrid,España,,100
Data Insights Analyst,Delectatech,2024-02-28,23,Híbrido,Jornada completa,Junior,"Analítica de datos, Capacidad de análisis, Ciencia de datos, SQL y Visualización de datos, Analítica, Conocimientos comerciales, Indicadores clave de desempeño, MongoDB y NoSQL",Data Analyst,Barcelona,Cataluña,España,,101
Data Analyst - Business Intelligence,Mystery Project,2024-02-21,13,Híbrido,Jornada completa,,"Analítica de datos, Bases de datos, Ciencia de datos y Visualización de datos, Análisis de negocio, Estadística, Extraer, transformar y cargar (ETL), Indicadores clave de desempeño, Modelado de datos y Qlik Sense",Data Analyst,Figueres,Cataluña,España,,102
Analista de datos,RDT Ingenieros,2024-02-13,11,Presencial,Jornada completa,Junior,,Data Analyst,Bilbao,País Vasco,España,,103
Analista BI,HH hunters,2023-08-13,443,Híbrido,Jornada completa,Intermedio,,Data Analyst,Madrid,Comunidad de Madrid,España,,104
Junior Insight Analyst,Harnham,2024-03-06,48,Presencial,Jornada completa,Intermedio,"Analítica de datos, Capacidad de análisis, Comunicación, Inglés, Microsoft Power BI y SQL, Analítica, Aptitudes para hacer presentaciones, Conocimientos comerciales y Panel de control",Data Analyst,Stafford,Inglaterra,Reino Unido,,105
BI Analyst (REMOTE),RemoteWorker UK,2024-03-08,371,En remoto,Jornada completa,Intermedio,"Analítica de datos, Análisis de datos, Bases de datos, Capacidad de análisis y Visualización de datos, Analítica, Evaluación de negocios, Extraer, transformar y cargar (ETL), Inteligencia empresarial y Panel de control",Data Analyst,,,Reino Unido,,106
Data Analyst - Python - Junior (m/f/d),emagine,2024-03-06,514,,,,"Analítica de datos, Análisis de datos y Visualización, Data Control, Desarrollo de API, Distributed Computing, Lado del servidor, Modelo de datos, Multiprocessing y PySpark",Data Analyst,Londres,Inglaterra,Reino Unido,,107
Apprentice Data Analyst - Data Science & Analytics,Smart DCC,2024-03-10,814,Presencial,Jornada completa,Junior,,Data Analyst,Mánchester,Inglaterra,Reino Unido,,108
Data Research Analyst - SMB (Remote),RemoteWorker UK,2024-03-12,6,En remoto,Jornada completa,Intermedio,"Analítica de datos, Ciencia de datos y Visualización de datos, Estadística, Investigación de datos, Investigación de mercado, Liderazgo de equipos, Manipulación de datos, Recogida de datos y System Performance",Data Analyst,Londres,Inglaterra,Reino Unido,,109
ESG Data Analyst,Formula 1,2024-03-12,1107,Presencial,Jornada completa,Intermedio,"Analítica de datos, Análisis de datos, Capacidad de análisis y Visualización de datos, Atención al detalle, Calidad de datos, Indicadores clave de desempeño, Presentaciones, Relaciones legislativas y Requisitos de información",Data Analyst,Londres,Reino Unido,,,110
Data Analyst: HR and People,Twinkl Educational Publishing,2024-02-21,1183,En remoto,,Intermedio,"Capacidad de análisis, SQL, Trabajo en equipo y Visualización de datos, Análisis de recursos humanos, Colaboraciones interdisciplinares, Elaboración de informes de datos, Recursos humanos (RR. HH.) y Sistemas de información de recursos humanos (HRIS)",Data Analyst,,,Reino Unido,40000,111
Data Analyst,FDM Group,2024-03-06,173,Híbrido,Jornada completa,Intermedio,"Análisis de datos, Capacidad de análisis, Ciencia de datos y Python, Documentación técnica, Medidas contra el lavado de dinero, R (Lenguaje de programación), Simulaciones, Tecnología de la información y Validación de modelos",Data Analyst,Londres,Inglaterra,Reino Unido,,112
Data Analyst - Link for MedTech (Remote),Veeva Systems,2024-02-28,369,En remoto,Jornada completa,,"SQL y Tableau, Análisis sanitario y Compromiso de los clientes",Data Analyst,,,Reino Unido,,113
Data Analyst (Graduate),Wabtec Corporation,2024-03-06,850,Presencial,Jornada completa,Junior,"Analítica de datos, Ciencia de datos y Visualización de datos, Catalogue Design, Gestión de datos, Indicadores clave de desempeño, Kitting, Operational Execution, Panel de control y Ventas de nuevos negocios",Data Analyst,Burton-upon-Trent,Inglaterra,Reino Unido,,114
Data Analyst REx Team,Accelerant,2024-03-12,1033,En remoto,Jornada completa,Junior,"Analítica de datos, Ciencia de datos, Comunicación, Resolución de problemas, Visualización y Visualización de datos, Analítica, Atención al detalle, Indicadores clave de desempeño y Panel de control",Data Analyst,,,Reino Unido,,115
Online Data Analyst,TELUS International,2024-03-06,981,En remoto,Media jornada,Junior,"Análisis de datos, Inglés y Investigación, Adquisición de conocimientos, Contenido online, Definición de requisitos, Inglés hablado, Investigación online, Medios de comunicación social y Trabajo en remoto",Data Analyst,Londres,Inglaterra,Reino Unido,,116
Online Data Analyst - United Kingdom,TELUS International,2024-02-28,365,En remoto,Media jornada,Junior,"Bases de datos, Capacidad de análisis, Inglés, Resolución de problemas y Visualización de datos, Aseguramiento de la calidad, Cultural Affairs, Investigación online, Medios de comunicación social y Motores de búsqueda",Data Analyst,Staffordshire,Inglaterra,Reino Unido,,117
Data Analyst FTC,Munich Re,2024-03-10,1158,Híbrido,Jornada completa,Junior,"Analítica de datos, Capacidad de análisis, Ciencia de datos, Limpieza de datos y Visualización de datos, Analítica, Gestión de datos, Informes ad hoc, Necesidades empresariales y Visual Basic for Applications (VBA)",Data Analyst,Londres,Inglaterra,Reino Unido,,118
SQL Data Analyst - 12M FTC,Robert Walters,2024-03-06,275,Presencial,,Junior,"Analítica de datos, Capacidad de análisis, SQL, Tableau y Visualización de datos, Dashboard Building, Documentación de proyectos, Gestión de partes interesadas, IT Documentation y Panel de control",Data Analyst,Londres,Inglaterra,Reino Unido,,119
Data Analyst Assistant,Aldi UK,2024-02-28,736,Híbrido,Jornada completa,Intermedio,"Comunicación, Administración de la cadena de suministro, Administración logística, Atención al detalle, Comunicación oral, Economía, Matemáticas, Mejora continua, Microsoft Excel y Microsoft Office",Data Analyst,Atherstone,Inglaterra,Reino Unido,,120
Graduate Data Analyst,Step5,2024-02-28,409,En remoto,,Junior,"Analítica de datos, Ciencia de datos, Resolución de problemas y Visualización de datos, Analítica, Automatización, Estadística, Matemáticas, Modelado de datos y Programme Recovery",Data Analyst,,,Reino Unido,30000,121
Data Analyst,Harnham,2024-03-11,830,En remoto,,Intermedio,"Python y SQL, Looker (software)",Data Analyst,Londres,Inglaterra,Reino Unido,60000,122
BI Analyst (REMOTE),InterQuest Group,2024-03-06,1088,En remoto,,Intermedio,Microsoft Power BI,Data Analyst,,,Reino Unido,25000,123
Rev-celerator Internship Programme: Data Analyst,Revolut,2024-03-06,510,,,Junior,,Data Analyst,Londres,Inglaterra,Reino Unido,,124
